Name,Description
Rajesh,Rajesh is a skilled chef who specializes in traditional Indian cuisine.
Priya,Priya is a talented singer who performs classical Indian music at cultural events.
Amit,Amit runs a successful tech startup that develops innovative apps for Indian users.
Ananya,Ananya is a renowned fashion designer known for her elegant Indian ethnic wear collections.
Suresh,Suresh is a dedicated social worker who helps underprivileged children access education in rural India.
Divya,Divya is an accomplished artist whose paintings often depict scenes from Indian mythology.
Rahul,Rahul is a passionate environmentalist working to promote sustainable farming practices in India.
Neha,Neha is a skilled software engineer who develops cutting-edge AI solutions for Indian companies.
Sanjay,Sanjay is a talented actor who has starred in numerous Bollywood films.
Pooja,Pooja is a successful entrepreneur who owns a chain of popular Indian restaurants.
Vikram,Vikram is a respected journalist known for his investigative reporting on corruption in Indian politics.
Kavita,Kavita is a dedicated teacher who strives to improve literacy rates in her village.
Arjun,Arjun is a skilled cricketer who plays for the Indian national team.
Shalini,Shalini is an award-winning author whose novels explore themes of love and family in Indian society.
Rohit,Rohit is a skilled architect who designs innovative eco-friendly buildings in urban India.
Meera,Meera is a talented dancer trained in classical Indian dance forms like Bharatanatyam.
Arun,Arun is a successful businessman who owns a chain of luxury hotels across India.
Anita,Anita is a renowned doctor who provides free medical care to impoverished communities in India.
Vishal,Vishal is a visionary filmmaker known for his groundbreaking work in Indian cinema.
Anjali,Anjali is a passionate animal rights activist working to end cruelty towards animals in India.
Gaurav,Gaurav is a talented musician who plays the tabla ( a traditional Indian percussion instrument ).
Shivani,Shivani is an innovative fashion designer known for her modern take on traditional Indian attire.
Sandeep,Sandeep is a dedicated NGO worker who provides disaster relief to communities affected by natural disasters in India.
Sunita,Sunita is a skilled chef who specializes in fusion cuisine blending Indian and international flavors.
Nitin,Nitin is a successful entrepreneur who founded a tech company that provides affordable internet access to rural areas in India.
Kiran,Kiran is a renowned poet whose verses capture the beauty and complexity of Indian life.
Manoj,Manoj is a talented photographer whose images showcase the diverse landscapes and cultures of India.
Ritu,Ritu is a dedicated environmental activist working to combat pollution and deforestation in India.
Raj,Raj is a successful businessman who owns a chain of popular fitness centers across India.
Aarti,Aarti is a skilled graphic designer who creates visually stunning designs for Indian brands.
Deepak,Deepak is a visionary entrepreneur who founded a renewable energy company that is revolutionizing the way India powers its cities.
Anil,Anil is a respected academic who conducts research on Indian history and culture.
Kriti,Kriti is a talented fashion designer known for her innovative use of traditional Indian textiles.
Prakash,Prakash is a dedicated social worker who runs a shelter for homeless people in urban India.
Preeti,Preeti is a successful businesswoman who founded a chain of organic grocery stores promoting sustainable farming practices in India.
Harish,Harish is a skilled engineer who designs innovative solutions to address water scarcity in India.
Anushka,Anushka is a talented actress who has won critical acclaim for her performances in Indian cinema.
Vijay,Vijay is a dedicated teacher who works tirelessly to improve the quality of education in government schools in India.
Nisha,Nisha is a successful entrepreneur who founded a nonprofit organization providing vocational training to women in rural India.
Rajendra,Rajendra is a respected lawyer who fights for justice and equality for marginalized communities in India.
Shobha,Shobha is a skilled chef who specializes in traditional South Indian cuisine.
Vinod,Vinod is a talented musician who plays the sitar a classical Indian string instrument.
Madhavi,Madhavi is a passionate advocate for women's rights in India working to end gender discrimination and violence.
Rajiv,Rajiv is a successful entrepreneur who founded a chain of eco-friendly hotels promoting sustainable tourism in India.
Kavitha,Kavitha is a dedicated doctor who provides healthcare services to rural communities in India.
